company,url
株式会社夢テクノロジー,https://www.yumeteku.jp/?utm_source=mae&utm_medium=bt
株式会社テクノプロ　テクノプロ・ＩＴ社,https://technopro.com/it/rec_c/
株式会社スタッフサービス　エンジニアリング事業本部,https://www.staffservice-engineering.jp/
ネプラス株式会社,https://www.neplus.jp/
株式会社アウトソーシングテクノロジー　SS事業部,https://www.ostechnology.co.jp/
株式会社テクノプロ　テクノプロ・エンジニアリング社,http://www.technopro.com/eng/
ランスタッド株式会社 randstad technologies エンジニア事業部,https://www.randstad.co.jp/
キャル株式会社,http://www.cal.co.jp/
株式会社テクノプロ　テクノプロ・ＩＴ社,https://technopro.com/it/rec_c/
株式会社ブレイン・ゲート,https://braingate.co.jp/
株式会社アクロビジョン,https://www.acrovision.jp/
株式会社Alt,
日本アイ・ビー・エムデジタルサービス株式会社,https://www.ibm.com/jp-ja/about/subsidiaries/ijds
株式会社スタッフサービス　エンジニアリング事業本部,https://www.staffservice-engineering.jp/
フルウィル株式会社,http://www.fulwill.co.jp/
株式会社メイテックフィルダーズ,https://www.m-fielders.co.jp/
株式会社アウトソーシングテクノロジー　SS事業部,https://www.ostechnology.co.jp/
フォーザウィン株式会社,http://forthewin.co.jp/
株式会社スタッフサービス　エンジニアリング事業本部,https://www.staffservice-engineering.jp/
ワールドホールディングス【合同募集】,https://recruit.whd-itengineer.jp/
株式会社アウトソーシングテクノロジー　SS事業部,https://www.ostechnology.co.jp/
株式会社Success Holders,https://success-holders.inc/
キンドリルジャパン株式会社,
Modis株式会社,https://career.modis.co.jp/
株式会社アソウ・アルファ,https://alpha.ahc-net.co.jp/recruit/
株式会社ウイルテック,https://www.willtec.jp/
株式会社日本情報開発,http://www.jid-net.com/
株式会社ビーネックステクノロジーズ,https://www.benextgroup.net/bnt/career_engineer
株式会社アルトナー,https://www.artner.co.jp/
株式会社ビーネックステクノロジーズ,https://www.benextgroup.net/bnt/career_engineer
ALH株式会社,https://www.alhinc.jp/company/
株式会社夢テクノロジー,https://www.yumeteku.jp/?utm_source=mae&utm_medium=bt
株式会社メイテック,http://recruit.meitec.co.jp/mt/career/
株式会社DAN,http://www.dan-inc.jp/#
ラーニンギフト株式会社,https://learningift.com/
株式会社パソナテック,https://www.pasonatech.co.jp/recruit/corp/message/
株式会社リクルートＲ＆Ｄスタッフィング,https://www.recruit-rds.co.jp/
ジャパニアス株式会社,http://www.jna.co.jp/
株式会社ワールドインテック テクノ・SI事業本部,https://www.witc.co.jp/
株式会社フレクト,https://www.flect.co.jp/
株式会社SHIFT,https://www.shiftinc.jp/
株式会社フレクト,https://www.flect.co.jp/
株式会社SHIFT,https://www.shiftinc.jp/
株式会社ワールドインテック テクノ・SI事業本部,https://www.witc.co.jp/
株式会社エスエスサポート,http://www.softs.co.jp/ss-support/
ラーニンギフト株式会社,https://learningift.com/
株式会社アウトソーシングテクノロジー　SS事業部,https://www.ostechnology.co.jp/
株式会社ワールドインテック テクノ・SI事業本部,https://www.witc.co.jp/
株式会社テクノクリエイティブ,https://www.techno-creative.co.jp/
株式会社ロココ,https://www.rococo.co.jp/
株式会社カレッジティアンドケイ,https://www.courage.co.jp/
LINE Fukuoka株式会社,https://linefukuoka.co.jp/ja/
CLINKS株式会社,http://www.clinks.jp/
株式会社ティーネットジャパン,https://www2.tn-japan.co.jp/ss/
キャル株式会社,http://www.cal.co.jp/
株式会社モバイルコミュニケーションズ,http://www.mcoms.co.jp/
株式会社MapleSystems,https://maplesystems.co.jp/
株式会社シーフォース,https://www.c-force-corp.co.jp/
株式会社ヒューマンキャピタル,https://www.human-capital.jp/
株式会社エル・フィールド,https://www.lfield.co.jp/recruit/
オムロン ソフトウェア株式会社,
株式会社セラク,http://www.seraku.co.jp/
Marvel株式会社,https://marvel.engineer/company/
株式会社セラク,http://www.seraku.co.jp/
株式会社デジタル・ナレッジ,https://www.digital-knowledge.co.jp/
株式会社テクノジャパン,https://www.techno-japan.co.jp/
株式会社ウェム,https://www.vv-e-nn.com/
チエル株式会社,https://www.chieru.co.jp/
アルファテクノロジー株式会社,https://alphatc.co.jp/
株式会社クロスゲームズ,http://www.cross-games.jp/
パーソル エクセル HRパートナーズ株式会社 ソリューション本部,https://persol-hrpartners.co.jp/
株式会社アーシャルデザイン,https://www.a-cial.com/
株式会社スタイル・フリー,http://www.style-free.co.jp/
株式会社アイ・ポイント,http://ai-point.co.jp/company/
Modis株式会社,https://career.modis.co.jp/
アマゾン ウェブ サービス ジャパン合同会社,https://aws.amazon.com/jp/careers/
株式会社リクルートＲ＆Ｄスタッフィング,https://www.recruit-rds.co.jp/
株式会社アベールジャパン,https://www.avail-japan.co.jp/
株式会社シーエスコミュニケーション,https://www.cs-com.co.jp/
株式会社SHIFT,https://www.shiftinc.jp/
オムロンフィールドエンジニアリング株式会社,http://www.omron-fe.co.jp/index.html
株式会社セラク,http://www.seraku.co.jp/
株式会社アーシャルデザイン,https://www.a-cial.com/
フィラーシステムズ株式会社,https://www.fsz.co.jp/
ランスタッド株式会社 randstad technologies エンジニア事業部,https://www.randstad.co.jp/
近代システムビューロー株式会社,http://www.ksbkk.co.jp/
サークレイス株式会社,https://www.circlace.com/
株式会社アリーナ・プロフェッショナル,https://www.arena-pro.co.jp/
スイングバイテクノロジー株式会社,https://swingbytech.co.jp/
株式会社ファインディックス,https://www.findix.co.jp/
フロッグウェル株式会社,https://www.frogwell.co.jp/
Modis株式会社,https://career.modis.co.jp/
株式会社メイテック,http://recruit.meitec.co.jp/mt/career/
株式会社スタートアップテクノロジー,https://startup-technology.com/
J-POWERテレコミュニケーションサービス株式会社,https://www.jpts.co.jp/
株式会社エージェントゲート,https://carechen.jp/change/carekotsu
SDFinancialTechnology株式会社,https://hoken-vos.socio-diversity.co.jp/
株式会社クリック,http://www.click.co.jp/
株式会社トリプル・フィールド,https://triple-field.co.jp/index.html
Modis株式会社,https://career.modis.co.jp/
